{
  "version": "0.1",
  "run_id": "run_negative_001",
  "agent": "claude-code",
  "model": "claude-sonnet-4-5",
  "started_at": "2026-04-20T10:03:00.000Z",
  "ended_at": "2026-04-20T10:03:01.500Z",
  "duration_ms": 1500,
  "metadata": {},
  "events": [
    {
      "id": "e1",
      "type": "skill.matched",
      "name": "cloud-logs",
      "ts": "2026-04-20T10:03:00.100Z",
      "source": "native",
      "confidence": "high",
      "data": {
        "prompt": "Show me the latest deployment logs for this service",
        "candidates": ["cloud-deploy", "cloud-logs", "cloud-status"],
        "score": 0.92
      }
    },
    {
      "id": "e2",
      "type": "skill.activated",
      "name": "cloud-logs",
      "ts": "2026-04-20T10:03:00.120Z",
      "source": "native",
      "confidence": "high",
      "data": {}
    }
  ]
}
