{
  "version": "0.1",
  "run_id": "run_e2e_001",
  "agent": "claude-code",
  "model": "claude-sonnet-4-5",
  "started_at": "2026-04-20T10:02:00.000Z",
  "ended_at": "2026-04-20T10:02:12.400Z",
  "duration_ms": 12400,
  "metadata": {
    "ci_job": "skill-trust-ci-42",
    "git_sha": "abc1234"
  },
  "events": [
    {
      "id": "e1",
      "type": "skill.matched",
      "name": "cloud-deploy",
      "ts": "2026-04-20T10:02:00.100Z",
      "source": "native",
      "confidence": "high",
      "data": {}
    },
    {
      "id": "e2",
      "type": "skill.activated",
      "name": "cloud-deploy",
      "ts": "2026-04-20T10:02:00.120Z",
      "source": "native",
      "confidence": "high",
      "data": {}
    },
    {
      "id": "e3",
      "type": "hook.started",
      "name": "check-repo",
      "ts": "2026-04-20T10:02:00.200Z",
      "source": "native",
      "confidence": "high",
      "data": {}
    },
    {
      "id": "e4",
      "type": "hook.succeeded",
      "name": "check-repo",
      "ts": "2026-04-20T10:02:00.260Z",
      "source": "native",
      "confidence": "high",
      "data": {}
    },
    {
      "id": "e5",
      "type": "hook.started",
      "name": "check-auth",
      "ts": "2026-04-20T10:02:00.300Z",
      "source": "native",
      "confidence": "high",
      "data": {}
    },
    {
      "id": "e6",
      "type": "hook.succeeded",
      "name": "check-auth",
      "ts": "2026-04-20T10:02:00.340Z",
      "source": "native",
      "confidence": "high",
      "data": {}
    },
    {
      "id": "e7",
      "type": "hook.started",
      "name": "generate-config",
      "ts": "2026-04-20T10:02:00.400Z",
      "source": "native",
      "confidence": "high",
      "data": {}
    },
    {
      "id": "e8",
      "type": "file.created",
      "name": ".deploy/service.yaml",
      "ts": "2026-04-20T10:02:00.430Z",
      "source": "native",
      "confidence": "high",
      "data": {
        "path": ".deploy/service.yaml"
      }
    },
    {
      "id": "e9",
      "type": "hook.succeeded",
      "name": "generate-config",
      "ts": "2026-04-20T10:02:00.450Z",
      "source": "native",
      "confidence": "high",
      "data": {}
    },
    {
      "id": "e10",
      "type": "hook.started",
      "name": "deploy",
      "ts": "2026-04-20T10:02:00.500Z",
      "source": "native",
      "confidence": "high",
      "data": {}
    },
    {
      "id": "e11",
      "type": "command.executed",
      "name": "cloud-cli deploy",
      "ts": "2026-04-20T10:02:00.520Z",
      "source": "native",
      "confidence": "high",
      "parent_id": "e10",
      "data": {
        "exit_code": 0
      }
    },
    {
      "id": "e12",
      "type": "api.called",
      "name": "create_service",
      "ts": "2026-04-20T10:02:01.020Z",
      "source": "shim",
      "confidence": "high",
      "parent_id": "e10",
      "data": {
        "method": "POST",
        "url": "https://api.example.com/v1/services",
        "status": 201
      }
    },
    {
      "id": "e13",
      "type": "hook.succeeded",
      "name": "deploy",
      "ts": "2026-04-20T10:02:02.100Z",
      "source": "native",
      "confidence": "high",
      "data": {}
    },
    {
      "id": "e14",
      "type": "hook.started",
      "name": "verify",
      "ts": "2026-04-20T10:02:02.200Z",
      "source": "native",
      "confidence": "high",
      "data": {}
    },
    {
      "id": "e15",
      "type": "api.called",
      "name": "get_service_health",
      "ts": "2026-04-20T10:02:02.350Z",
      "source": "shim",
      "confidence": "high",
      "parent_id": "e14",
      "data": {
        "method": "GET",
        "url": "https://api.example.com/v1/services/svc_123/health",
        "status": 200
      }
    },
    {
      "id": "e16",
      "type": "hook.succeeded",
      "name": "verify",
      "ts": "2026-04-20T10:02:02.500Z",
      "source": "native",
      "confidence": "high",
      "data": {}
    },
    {
      "id": "e17",
      "type": "outcome.pass",
      "name": "deploy_happy_path",
      "ts": "2026-04-20T10:02:02.600Z",
      "source": "native",
      "confidence": "high",
      "data": {
        "message": "deployment succeeded and service is healthy",
        "contains": ["deployment succeeded", "healthy"]
      }
    }
  ]
}
