{
  "version": "0.1",
  "run_id": "run_activate_001",
  "agent": "claude-code",
  "model": "claude-sonnet-4-5",
  "started_at": "2026-04-20T10:01:00.000Z",
  "ended_at": "2026-04-20T10:01:01.800Z",
  "duration_ms": 1800,
  "metadata": {},
  "events": [
    {
      "id": "e1",
      "type": "skill.matched",
      "name": "cloud-deploy",
      "ts": "2026-04-20T10:01:00.100Z",
      "source": "native",
      "confidence": "high",
      "data": {
        "prompt": "Deploy this service to the cloud",
        "candidates": ["cloud-deploy", "cloud-logs", "cloud-status"],
        "score": 0.95
      }
    },
    {
      "id": "e2",
      "type": "skill.activated",
      "name": "cloud-deploy",
      "ts": "2026-04-20T10:01:00.120Z",
      "source": "native",
      "confidence": "high",
      "data": {}
    }
  ]
}
